data_publicacao,edicao,codigo_evento,titulo,pagina,municipio,localidade,tipo_camada,dimensao_analitica,tipo_relacao_variavel,codigo_variavel,nivel_criticidade,observacao,papel_no_ciclo,id_caso_pressao,entra_ipst,nota_analista,aproximacao_variavel,cod_loteamento,nivel_confianca_loteamento
2026-01-07,9645,E1,"Feminicidio de Rayana Raissa Albuquerque de Matos; 21 anos; em Hortolandia — relatado em Carta Aberta da Procuradoria Especial das Mulheres ALESP",2,Hortolândia,nao_identificado,PRESSAO_SOCIAL,capital_humano,direta,SMIDS_EXT,alerta,dado_auditavel,agravamento,CH_VIOLENCIA_GENERO_2025,"sim - Condicao A","Rayana Raissa Albuquerque de Matos; 21 anos; assassinada dentro de casa na presenca do proprio filho. Fonte: Carta Aberta institucional da Procuradoria Especial das Mulheres (Alesp); Ana Perugini; publicada na ed. 9645. R21: violencia letal → nunca contextual → direta. Terceiro caso no ciclo CH_VIOLENCIA_GENERO_2025 (E1 ed.9643 = Jacira Martins; E1 ed.9645 = Rayana). Crime posterior ao fechamento do corpus desta semana; data exata nao identificada. Carta nomeia o caso como 'nao episodio isolado' — sinal de sistematicidade reconhecida institucionalmente.",,nao_identificado,baixo
2026-01-07,9645,E2,"Omissao GOV_ESTADUAL: 70% do orcamento para politicas de mulheres nao executado em 2025 em SP",2,Hortolândia,nao_identificado,PRESSAO_SOCIAL,capital_humano,direta,SMIDS_EXT,alta,dado_auditavel,agravamento,CH_VIOLENCIA_GENERO_2025,"sim - Condicao B","70% do orcamento da Secretaria de Politicas para a Mulher (SP) nao executado em 2025. DDMs operando apenas em horario comercial (violacao da lei federal que exige 24h). Programas de acolhimento; protecao; capacitacao e autonomia economica paralisados ou subfinanciados. Fonte: Carta Aberta institucional Procuradoria Especial Mulheres (Alesp). Secao 21 v10.2: PRESSAO_SOCIAL (tratamento de PRESSAO_INSTITUCIONAL → omissao sistemica que amplifica ciclo CH_VIOLENCIA_GENERO). Dado auditavel pelo Portal Transparencia SP. R23: % de execucao orcamentaria e agregavel em serie anual.",,nao_identificado,baixo
2026-01-07,9645,E3,"Hortolandia entrega 11 novos campos de futebol society; meta de 18 espacos esportivos publicos",1/7,Hortolândia,"Jd. Santa Clara / Jd. Amanda",GOVERNANCA,capital_humano,indireta,GOV_MUNICIPAL,baixa,dado_auditavel,nao_aplicavel,,"nao — GOVERNANCA nao satisfaz Condicoes A nem B","12 campos instalados (meta: 18). Inauguracoes recentes dez/2025: Jd. Santa Clara (maior campo da cidade; R. Pedro Pereira dos Santos; recuperacao alambrados + LED + academia) e Jd. Amanda (parque socioambiental; cercado por playgrounds; academia; pista de caminhada). Mapa completo dos campos existentes (dado territorial valioso para correlacao CadUnico): Jd. Santa Clara do Lago; Remanso Campineiro; Jd. Nova America; Jd. Santa Izabel; Jd. Minda; Jd. Alvorada (Arena); Jd. Novo Angulo (Praca Cidadania); Jd. Adelaide; Parque Gabriel (Lago da Fe); Jd. Santa Rita; Praca da Penha. Campo Jd. Amanda (novo parque socioambiental) conecta-se ao contexto da ed.9635 (E2 academia ao ar livre + fase 2 entregue em junho/2026).",, jd_santa_clara,alto
2026-01-07,9645,E4,"Equipes da Prefeitura de Hortolandia removem dispositivos vandalizados no Parque Socioambiental Lago da Fe",4,Hortolândia,Parque Gabriel,GOVERNANCA,infraestrutura_urbana,indireta,GOV_MUNICIPAL,baixa,sinal_smids_ext,nao_aplicavel,,"nao — GOVERNANCA nao satisfaz Condicoes A nem B","Aparelhos de academia ao ar livre e playground do Parque Socioambiental Lago da Fe (Parque Gabriel) removidos para conserto apos vandalismo. ~10 pracas/semana recebem zeladoria. 100+ espacos publicos na cidade. Zeladoria adicional: canteiros Av. Anhanguera e Av. Sao Francisco de Assis; areas verdes Jds. Sao Sebastiao/Interlagos; entorno OAPE; Jd. Santa Clara do Lago; Jd. Mirante. Nota analitica: vandalismo de equipamentos publicos e sinal de pressao social sobre o territorio — monitorar recorrencia para avaliar abertura de ciclo CH_VANDALISMO_ESPACOS_PUBLICOS.",,parque_gabriel,alto
2026-01-07,9645,E5,"Mulher desaparecida encontrada desorientada em praca do Jardim Nova Hortolandia",7,Hortolândia,Jardim Nova Hortolândia,CONTEXTO,capital_humano,contextual,SMIDS_EXT,baixa,caso_ilustrativo,nao_aplicavel,,"nao — CONTEXTO nao satisfaz Condicoes A nem B","Kamila Dias; 38 anos; desaparecida desde 03/01/2026; encontrada 06/01 pela Romu em praca do Jd. Nova Hortolandia. Apresentava sinais de desorientacao. Encaminhada ao HM Mario Covas; liberada apos avaliacao (sem internacao). Entregue aos familiares. R25: evento individual — aceito como CONTEXTO; monitorar recorrencia de casos de saude mental/desorientacao para avaliar promocao a PRESSAO_SOCIAL (proxy de vulnerabilidade em saude mental no territorio).",, jd_nova_hortolandia,alto
2026-01-07,9645,E6,"Homem preso com drogas apos sair de Uber no Jardim Adelaide; Hortolandia",9,Hortolândia,Jardim Adelaide,PRESSAO_SOCIAL,capital_humano,direta,SMIDS_EXT,alerta,dado_auditavel,agravamento,CH_TRAFICO_HORTOLANDIA_2026,"avaliar - R24/R25; promover a sim se serie territorial for confirmada","148g maconha + 46g cocaina + 8g dry + 10g crack + R$2.315 em especie (Rua Paulo Roberto Soares; Jd. Adelaide; 05/01/2026). Suspeito confessou funcao de 'coletor de dinheiro' de rede de trafico — nao ator solitario; indicativo de organizacao criminal estruturada. R25: trafico organizado e fenomeno coletivo com impacto direto sobre populacao vulneravel do territorio. R24: diferente do caso canonico de exclusao (acougue/E13); trafico organizado tem efeito sistemico verificavel. Jd. Adelaide ja consta no mapa dos campos society (E3) — loteamento de alta concentracao CadUnico confirmado.",,jd_adelaide,alto
