"fonte","data","item","pagina","dimensao_ivs","codigo_variavel","tipo_relacao_variavel","nivel_criticidade","resumo","origem","municipio_impactado","tipo_abrangencia","tipo_evento","cod_loteamento","nivel_confianca_loteamento","polaridade_evento","tipo_origem_evento","observacao","nota_analista"
"Tribuna Liberal","2026-04-16","CNH - renovacao automatica beneficia 2.194 motoristas em Hortolandia","04","SMIDS_EXT","","contextual","baixa","Detran-SP informa que a renovacao automatica da CNH beneficiou 2.194 motoristas em Hortolandia no periodo analisado, dentro de um total regional de 11.333 beneficiados.","Regional","Hortolandia","regional","indicador","nao_aplicavel","nao_aplicavel","positivo","mobilidade","interface_iu","sinal_administrativo_mobilidade"
"Tribuna Liberal","2026-04-16","Zeze Gomes agiliza Auxilio-Moradia a vitimas de violencia em Hortolandia","09","infraestrutura_urbana","IU_01","indireta","alta","Projeto aprovado flexibiliza exigencias e acelera concessao de auxilio-moradia para familias em situacao de risco, incluindo vitimas de violencia domestica.","Hortolandia","Hortolandia","local","politica_publica","nao_aplicavel","nao_aplicavel","positivo","assistencia_social","interface_iu","politica_habitacional_com_interface_social"
"Tribuna Liberal","2026-04-16","Curso vai orientar empreendedor sobre planejamento financeiro em Hortolandia","05","renda_trabalho","RT_02","indireta","baixa","Curso gratuito promovido em parceria com Sebrae orienta planejamento financeiro para empreendedores e interessados em abrir negocios.","Hortolandia","Hortolandia","local","politica_publica","nao_aplicavel","nao_aplicavel","positivo","empreendedorismo","interface_rt","capacitacao_empreendedora"
"Tribuna Liberal","2026-04-16","Hortolandia imuniza mais de 9 mil moradores contra gripe","09","capital_humano","CH_01","indireta","media","Campanha de vacinacao contra gripe atinge 9.277 pessoas dos grupos prioritarios, com destaque para idosos.","Hortolandia","Hortolandia","local","politica_publica","nao_aplicavel","nao_aplicavel","positivo","saude","aproximacao_variavel","acao_preventiva_saude_com_dado_operacional"
"Tribuna Liberal","2026-04-16","Hortolandia retoma a construcao de pista de skate no Remanso das Aguas","09","capital_humano","CH_03","indireta","baixa","Prefeitura retoma obra de pista de skate com investimento aproximado de R$ 640 mil, incluindo estrutura esportiva e paisagismo.","Hortolandia","Hortolandia","local","politica_publica","66","medio","positivo","esporte","caso_ilustrativo","nome_jornalistico_remanso_das_aguas"
"Tribuna Liberal","2026-04-16","Casal e preso apos agressoes mutuas em Hortolandia","09","capital_humano","","contextual","alerta","Casal e preso em flagrante no bairro Monte Sinai apos agressoes mutuas durante discussao; ambos apresentavam sinais de embriaguez.","Hortolandia","Hortolandia","local","problema","nao_identificado","baixo","negativo","seguranca","sinal_smids_ext","sinal_SMIDS_EXT; bairro_monte_sinai"
