fonte,data,item,pagina,dimensao_analitica,codigo_variavel,resumo,origem,municipio_impactado,tipo_abrangencia,tipo_evento,gravidade,tipo_relacao,polaridade_evento,observacao,cod_loteamento,nivel_confianca_loteamento,tipo_camada,papel_no_ciclo,id_caso_pressao,entra_ipst
Tribuna Liberal,2026-05-06,E01,9,CH,,Menina de 11 anos morre apos colisao entre moto conduzida pelo pai e onibus no Parque Ortolandia. Crianca estava na garupa e foi arrastada sob o veiculo. Obito constatado no local pelo Samu.,Hortolandia,Hortolandia,local,alerta,critico,direta,negativo,R21: violencia letal sempre direta. Agravamento do ciclo CH_VIOLENCIA_CRIANCA_2026. Bito de crianca em acidente de transito com onibus.,,,PRESSAO_SOCIAL,agravamento,CH_VIOLENCIA_CRIANCA_2026,sim
Tribuna Liberal,2026-05-06,E02,8,CH,SMIDS_EXT,Prefeito Zeze Gomes vistoria frentes de obra do Parque Socioambiental do Jardim Amanda: campo society com grama sintetica; quadra poliesportiva; pista de caminhada; ciclovia; canalização de corrego na UPA. Anuncio de nova UBS para Amanda II.,Hortolandia,Hortolandia,local,resposta_governo,baixa,indireta,positivo,Investimento em infraestrutura de lazer e saude no loteamento com maior concentracao de analfabetos (1045) e vulnerabilidade identificada. Nao vinculado a ciclo de pressao especifico no corpus.,351,alto,GOVERNANCA,,, nao
Tribuna Liberal,2026-05-06,E03,5,RT,,Levantamento do TRE-SP aponta 49.7 mil titulos cancelados na regiao. Hortolandia lidera com 16.035 cancelamentos: 8.983 por ausencia na revisao biometrica e 7.052 por ausencia nos tres ultimos pleitos. Prazo de regularizacao encerra nesta quarta-feira (6).,Regional,Hortolandia,regional,alerta,moderada,indireta,negativo,Exclusao civica em escala relevante. Sem variavel IVS direta mas indicador de afastamento institucional com potencial impacto em acesso a beneficios e programas sociais. Dado externo ao IVS.,,,CONTEXTO,,,nao
Tribuna Liberal,2026-05-06,E04,4,IU,IU_01,Monte Mor institui Comite Municipal de Seguranca Hidrica e notifica a Sabesp. Comite com carater permanente: analise de laudos tecnicos; cobranca de providencias; atuacao como sala de situacao em emergencias. Causa: baixo fluxo do Rio Jaguari concentra compostos naturais.,Monte Mor,Hortolandia,regional,resposta_governo,baixa,indireta,positivo,Resposta regional ao ciclo IU_AGUA_SABESP_2026. Municipios vizinhos adotando estruturas de monitoramento. Sabesp aplicou carvao ativado (CAP) como tratamento avancado.,,,GOVERNANCA,resposta,IU_AGUA_SABESP_2026,nao
Tribuna Liberal,2026-05-06,E05,8,RT,RT_02,CAGED marco 2026: Hortolandia registra saldo positivo de 540 vagas de emprego. Segundo melhor resultado da serie historica iniciada em 2020. 448 vagas no setor servicos. Municipio respondeu por mais de 55% da geracao de empregos formais da RPT no periodo.,Hortolandia,Hortolandia,local,dado_oficial,baixa,indireta,positivo,Contexto positivo para RT_02 (desocupacao) e RT_03 (informalidade). Setor servicos liderou. 13 novas empresas instaladas em marco. Dado CAGED — emprego formal apenas.,,,CONTEXTO,,,nao
Tribuna Liberal,2026-05-06,E06,8,CH,CH_05,Departamento da Mulher da Prefeitura de Hortolandia instala estande da campanha Nao e Nao na Festa do Peao. Seis noites de programacao a partir de 08/05. Acoes: conscientizacao sobre consentimento; distribuicao de materiais; rondas preventivas com Guarda Municipal.,Hortolandia,Hortolandia,local,resposta_governo,baixa,indireta,positivo,Resposta institucional ao ciclo CH_VIOLENCIA_GENERO_2025. Acao proativa preventiva em evento de massa. Integracao Departamento da Mulher e Guarda Municipal.,,,GOVERNANCA,resposta,CH_VIOLENCIA_GENERO_2025,nao
Tribuna Liberal,2026-05-06,E07,9,CH,SMIDS_EXT,Idosa de 78 anos morre apos atropelamento e progressao de complicacoes. Atropelamento em 29/04 no Jardim Amanda. Liberada da UPA sem exame de imagem. Retornou com dores; fratura diagnosticada. Internada para cirurgia. Obito em 04/05 por mal subito em casa.,Hortolandia,Hortolandia,local,alerta,critico,latente,negativo,Progressao temporal interna a materia: atropelamento → alta sem exame → retorno → fratura → internacao → obito. Cadeia de vulnerabilidade institucional. R21 nao se aplica: nao e violencia letal direta. Atravessa UPA; diagnostico tardio; cuidado longitudinal fragilizado. Candidato futuro a tipo_pressao=progressiva. Inauguracao de ciclo RT_VULNERABILIDADE_IDOSO_2026.,351,alto,PRESSAO_SOCIAL,emergencia,RT_VULNERABILIDADE_IDOSO_2026,sim
