data_edicao,numero_edicao,evento_id,titulo,pagina,municipio,tipo_camada,dimensao_analitica,codigo_variavel,nivel_criticidade,localidade,relevancia,tipo_relacao_variavel,papel_no_ciclo,entra_ipst,id_caso_pressao,descricao_evento,nota_analista,fonte_arquivo,observacao,status_validacao
2026-06-23,9.788,E01,Vereadores protocolam CPI da Merenda para investigar gestão Dalben em Sumaré,3,,PRESSAO_SOCIAL,governanca,GOV_MUNICIPAL / CONTROLE_PUBLICO,media,nao_identificado,alta,indireta,pressao_institucional,avaliar,GOV_CPI_MERENDA_SUMARE_2026,Vereadores protocolam CPI da Merenda para investigar gestão Dalben em Sumaré,"CPI apura licitação, contratos emergenciais, qualidade nutricional e supostas relações imobiliárias; importante benchmark de controle e risco de contratos sociais.",TRIBUNA LIBERAL 23-06-26.pdf,,normalizado_v10_5
2026-06-23,9.788,E02,Sumaré faz mutirão de empregos com 40 vagas para Auxiliar de Movimentação,3,,CONTEXTO,renda_trabalho,RT_02 / EMPREGO_FORMAL,baixa,nao_identificado,baixa,indireta,contexto_regional,nao,,Sumaré faz mutirão de empregos com 40 vagas para Auxiliar de Movimentação,"Ação de empregabilidade com participação possível de moradores de Hortolândia; referência para Desenvolvimento Econômico, mas sem recorte Atlas.",TRIBUNA LIBERAL 23-06-26.pdf,,normalizado_v10_5
2026-06-23,9.788,E03,"Americana abre 26 empresas por dia em 2026, diz Observatório Econômico",4,,CONTEXTO,renda_trabalho,RT_02 / DINAMISMO_ECONOMICO,baixa,nao_identificado,baixa,indireta,contexto_regional,nao,,"Americana abre 26 empresas por dia em 2026, diz Observatório Econômico",Dado regional de abertura de empresas e uso de observatório econômico; bom benchmark para inteligência econômica municipal.,TRIBUNA LIBERAL 23-06-26.pdf,,normalizado_v10_5
2026-06-23,9.788,E04,Terraplenagem demarca obra do novo Centro de Reabilitação de Hortolândia,6,,GOVERNANCA,capital_humano,CH_PCD / SAUDE_REABILITACAO,baixa,Green Park / Vila da Saúde,alta,direta,resposta,avaliar,,Terraplenagem demarca obra do novo Centro de Reabilitação de Hortolândia,"Obra de R$ 7 milhões para CER; integra reabilitação física e intelectual e fortalece o eixo PcD, saúde e cuidado especializado.",TRIBUNA LIBERAL 23-06-26.pdf,,normalizado_v10_5
2026-06-23,9.788,E05,Mecânico morre esmagado durante manutenção de ônibus no Jardim Amanda I,6,,PRESSAO_SOCIAL,capital_humano,SMIDS_EXT / ACIDENTE_TRABALHO,alta,351 (Jardim Amanda),media,direta,emergencia,sim,CH_ACIDENTE_TRABALHO_AMANDA_2026,Mecânico morre esmagado durante manutenção de ônibus no Jardim Amanda I,Morte em garagem de coletivos; reforça Jardim Amanda como território recorrente de eventos críticos e pressão social.,TRIBUNA LIBERAL 23-06-26.pdf,,normalizado_v10_5
2026-06-23,9.788,E06,Obra do Viaduto da Mancini avança e inicia nova etapa em Sumaré,7,,CONTEXTO,infraestrutura_urbana,IU_MOBILIDADE_URBANA,baixa,nao_identificado,baixa,indireta,contexto_regional,nao,,Obra do Viaduto da Mancini avança e inicia nova etapa em Sumaré,"Intervenção regional de mobilidade; manter como benchmark de obra estruturante, sem aderência direta ao Atlas.",TRIBUNA LIBERAL 23-06-26.pdf,,normalizado_v10_5
2026-06-23,9.788,E07,Incêndio em comércio causa apreensão no Centro de Hortolândia,7,,PRESSAO_SOCIAL,infraestrutura_urbana,SMIDS_EXT / RISCO_URBANO,media,Centro / Jardim das Paineiras,media,direta,emergencia,avaliar,IU_INCENDIO_COMERCIO_CENTRO_2026,Incêndio em comércio causa apreensão no Centro de Hortolândia,"Incêndio em loja de roupas sem feridos; indica pressão urbana, resposta emergencial e necessidade de perícia.",TRIBUNA LIBERAL 23-06-26.pdf,,normalizado_v10_5
2026-06-23,9.788,E08,Homem é preso com 111 porções de cocaína no Jardim Amanda,9,,PRESSAO_SOCIAL,capital_humano,SMIDS_EXT / SEGURANCA_PUBLICA,media,351 (Jardim Amanda),media,direta,pressao_social,sim,CH_DROGAS_AMANDA_2026,Homem é preso com 111 porções de cocaína no Jardim Amanda,"Ocorrência de tráfico reforça monitoramento do Jardim Amanda como hotspot recorrente em segurança, saúde e vulnerabilidade territorial.",TRIBUNA LIBERAL 23-06-26.pdf,,normalizado_v10_5
