fonte,data,item,pagina,tipo_camada,dimensao_analitica,codigo_variavel,tipo_relacao_variavel,nivel_criticidade,resumo,origem,municipio_impactado,tipo_abrangencia,localidade,cod_loteamento,nivel_confianca_loteamento,papel_no_ciclo,id_caso_pressao,entra_ipst,observacao,nota_analista
Tribuna Liberal,2026-06-03,E001,05,GOVERNANCA,renda_trabalho,RT_02,indireta,informativo,Camara aprova cessao de terreno de 10187 m2 no Remanso Campineiro ao Centro Paula Souza para implantacao da FATEC,Hortolandia,Hortolandia,local,Remanso Campineiro,nao_identificado,baixa,nao_aplicavel,,nao,investimento_formacao_profissional,Projeto aprovado em regime de urgencia. Terreno proximo a Av. Olivio Franceschini. Prazo de 5 anos para funcionamento com clausula de reversao automatica. Area nao pode ser usada como garantia financeira. RT_02 como proxy — formacao tecnologica superior como vetor de empregabilidade e reducao da informalidade. Acao estrutural de longo prazo sem pressao previa documentada no corpus (R22 aplicada).
Tribuna Liberal,2026-06-03,E002,09,CONTEXTO,vazio,vazio,nao_aplicavel,baixa,PF deflagra operacao e cumpre mandados em Hortolandia Paulinia Campinas e Valinhos em combate a corrupcao na Receita Federal,Hortolandia,Hortolandia,local,vazio,nao_identificado,baixa,nao_aplicavel,,nao,evento_institucional,Operacao da PF contra ex-dirigente da Receita Federal suspeito de receber propinas em importacao e exportacao. 24 mandados de busca e apreensao em SP e SC. 12 mandados na RMC incluindo Hortolandia. Investigacao apura movimentacao de ao menos R$ 2 milhoes. Evento de seguranca publica e corrupcao federal sem vínculo com variavel IVS e sem potencial de serializacao (R24). Rebaixado — nao excluido (R06).
Tribuna Liberal,2026-06-03,E003,07,GOVERNANCA,capital_humano,CH_01,indireta,informativo,Deputado Vicentinho confirma emenda parlamentar de R$ 7 milhoes para a saude de Hortolandia,Hortolandia,Hortolandia,local,vazio,nao_identificado,baixa,nao_aplicavel,,nao,investimento_saude,R$ 5,7 milhoes ja depositados e R$ 1,3 milhao a liberar. Recursos destinados a acoes e servicos de saude sem especificacao de aplicacao. Acao estrutural sem pressao previa documentada no corpus (R22 aplicada). Contextualmente relevante para o ciclo de demanda por 3a UBS que o corpus ja registra e para o gap de cobertura em saude da mulher identificado no IVS-H. CH_01 como proxy — investimento em saude publica com potencial impacto em mortalidade e cobertura.
Tribuna Liberal,2026-06-03,E004,05,PRESSAO_SOCIAL,infraestrutura_urbana,IU_01,indireta,informativo,Colisao entre motocicleta e bicicleta no Jardim Amanda II — adolescente de 12 anos que voltava da escola entre os feridos,Hortolandia,Hortolandia,local,Jardim Amanda II,nao_identificado,alta,emergencia,,nao,evento_viario,Colisao no cruzamento da Av. Brasil com Rua Erico Verissimo proximo a unidade escolar. Motociclista de 20 anos sem CNH. Vitima ciclista adolescente de 12 anos retornando da escola. Ferimentos leves em ambos. Encaminhados a UPA Jardim Amanda. Evento pontual sem potencial de serializacao (R24) — nao entra no IPSO-H. Registrado por ocorrer no Jardim Amanda em horario escolar com crianca como vitima. IU_01 como proxy — infraestrutura viaria precaria em area escolar.
Tribuna Liberal,2026-06-03,E005,09,PRESSAO_SOCIAL,capital_humano,CH_05,direta,alerta,Homem preso por violencia domestica no Jardim Amanda — segundo registro em 48 horas no mesmo loteamento,Hortolandia,Hortolandia,local,Jardim Amanda,nao_identificado,alta,agravamento,CH_VIOLENCIA_GENERO_2025,sim,dado_auditavel,Segundo registro de violencia domestica no Jardim Amanda em intervalo de 48 horas — 01/06 e 02/06. Vitima de 45 anos agredida e ameacada pelo companheiro dentro de casa. Preso em flagrante confirmado no Plantao Policial. Classificado como agravamento por R20: sequencia interna ao corpus documenta progressao temporal no mesmo loteamento. Reforco do ciclo CH_VIOLENCIA_GENERO_2025 com evidencia de concentracao espacial e temporal no Jardim Amanda.
