data_edicao,numero_edicao,evento_id,titulo,pagina,municipio,tipo_camada,dimensao_analitica,codigo_variavel,nivel_criticidade,localidade,relevancia,tipo_relacao_variavel,papel_no_ciclo,entra_ipst,id_caso_pressao,descricao_evento,nota_analista,fonte_arquivo,observacao,status_validacao
2026-05-16,9.751,E01,Tráfego em rua sob viaduto da Vila Real será liberado,01/09,Hortolândia,GOVERNANCA,infraestrutura_urbana,IU_03 / MOBILIDADE_URBANA,baixa,Vila Real,alta,direta,resposta,avaliar,IU_MOBILIDADE_VILA_REAL_2026,"Prefeitura libera trânsito na Rua Antônio Baraldo, via sob o Viaduto Monsenhor Décio Ravagnani, na região da Vila Real.",Resposta de mobilidade urbana com potencial redução de acidentes e melhora de integração territorial. Forte aderência ao eixo infraestrutura/mobilidade.,TRIBUNA LIBERAL 16-05-26 (1).pdf,recriado_a_partir_do_pdf,recriado_v10_5
2026-05-16,9.751,E02,Processo seletivo do Grupo Bimbo tem 130 candidatos em Hortolândia,09,Hortolândia,GOVERNANCA,renda_trabalho,RT_02 / INTERMEDIACAO_MAO_DE_OBRA,baixa,Remanso Campineiro / Hortolândia,alta,direta,resposta,avaliar,RT_BIMBO_WICKBOLD_HORTOLANDIA_2026,"Processo seletivo da empresa Bimbo, em parceria com a prefeitura, reuniu 130 candidatos para 20 vagas.","Ação direta de empregabilidade. Útil para eixo Desenvolvimento Econômico, RT_02 e futura comparação com CAGED/PAT.",TRIBUNA LIBERAL 16-05-26 (1).pdf,recriado_a_partir_do_pdf,recriado_v10_5
2026-05-16,9.751,E03,Projeto quer patrono da classe política de Hortolândia,01/07,Hortolândia,GOVERNANCA,governanca,GOV_LEGISLATIVO,baixa,Hortolândia,baixa,direta,contexto_operacional,nao,,Projeto legislativo propõe patrono da classe política de Hortolândia.,Evento institucional de baixa aderência ao Atlas; manter apenas como governança legislativa contextual.,TRIBUNA LIBERAL 16-05-26 (1).pdf,recriado_a_partir_do_pdf,recriado_v10_5
2026-05-16,9.751,E04,Empresas de Sumaré são investigadas por fraude no transporte estadual PCD,01/08,Sumaré / Regional,CONTEXTO,capital_humano,CH_PCD / INTEGRIDADE_CONTRATUAL,alta,regional,alta,indireta,pressao_institucional,avaliar,CH_FRAUDE_TRANSPORTE_PCD_SUMARE_2026,"Empresas ligadas a Sumaré são alvo de operação sobre suspeitas de fraude no transporte especial Ligado, destinado a estudantes com deficiência.","Alta relevância para governança de políticas de PCD, contratação pública e risco de desvio em serviço sensível. Regional, mas dialoga com eixo PcD do Atlas.",TRIBUNA LIBERAL 16-05-26 (1).pdf,recriado_a_partir_do_pdf,recriado_v10_5
2026-05-16,9.751,E05,5 mil candidatos vão ao maior feirão de empregos da história de Sumaré,04,Sumaré,CONTEXTO,renda_trabalho,RT_02 / EMPREGO_FORMAL,baixa,Sumaré,media,indireta,contexto_regional,nao,,Feirão de Empregos de Sumaré reuniu cerca de 5 mil pessoas e mais de 70 empresas.,Contexto regional de empregabilidade e resposta pública de intermediação de mão de obra.,TRIBUNA LIBERAL 16-05-26 (1).pdf,recriado_a_partir_do_pdf,recriado_v10_5
2026-05-16,9.751,E06,Paulínia terá até 100 novas lombadas para segurança viária,05,Paulínia,CONTEXTO,infraestrutura_urbana,SMIDS_EXT / SEGURANCA_VIARIA,baixa,regional,media,indireta,benchmark_regional,nao,,"Paulínia anuncia pacote de segurança viária com instalação inicial de 35 lombadas, podendo chegar a 100.",Benchmark regional de resposta a acidentes e segurança viária; útil para comparação com eventos de risco em Hortolândia.,TRIBUNA LIBERAL 16-05-26 (1).pdf,recriado_a_partir_do_pdf,recriado_v10_5
2026-05-16,9.751,E07,BRK leva educação ambiental para mais de 6 mil alunos com Ciclo das Águas,03,Sumaré / Regional,CONTEXTO,infraestrutura_urbana,IU_01 / EDUCACAO_AMBIENTAL_SANEAMENTO,baixa,regional,baixa,indireta,contexto_regional,nao,,Projeto Ciclo das Águas levou educação ambiental e saneamento para 6.311 alunos em seis cidades.,"Ação educativa de saneamento e meio ambiente. Contexto regional de capital humano/infraestrutura, sem pressão direta em Hortolândia.",TRIBUNA LIBERAL 16-05-26 (1).pdf,recriado_a_partir_do_pdf,recriado_v10_5
