id_evento,data_publicacao,fonte,titulo,pagina,municipio,localidade,tipo_camada,dimensao_analitica,tipo_relacao_variavel,codigo_variavel,nivel_criticidade,observacao,aproximacao_variavel,nota_analista,cod_loteamento,nivel_confianca_loteamento,papel_no_ciclo,id_caso_pressao,entra_ipst
E1,2026-04-23,Tribuna Liberal,Consumidores de Monte Mor Paulinia e Hortolandia vivem problema com odores na agua,4,Hortolândia,Jardim Mônaco,PRESSAO_SOCIAL,infraestrutura_urbana,direta,SMIDS_EXT,alta,dado_auditavel,,"""Registro mais antigo do ciclo IU_QUALIDADE_AGUA_2026. Em Hortolandia: moradores do Jardim Monaco protocolaram reclamacao oficial. OAB local (Comissao de Meio Ambiente, presidente Denilson Cazuza) acompanha o caso. Em Paulinia: Santa Cecilia e regiao central. Em Monte Mor: Jardim Campos Dourados e Jardim Sao Clemente. Relatos: cheiro de mofo, aspecto de barro apos intervencoes na rede, nauseas, vomitos, dor de barriga. Moradores comprando agua mineral. Sabesp responde com nota alegando variacoes naturais no gosto e no cheiro sem interferencia na potabilidade (nota contestada pelos moradores). Caso chegou ao Legislativo de Monte Mor: vereador Prof. Adriel (PDT). Cronologia do ciclo: 23/04 TL (emergencia) -> 22/04 doc Prefeitura a Arsesp (anterior ao corpus) -> 23/04 mocao Camara -> 24/04 vistoria ETA -> 25/04 materia completa TL.""",,,emergencia,IU_QUALIDADE_AGUA_2026,sim - Condicao B
E2,2026-04-23,Tribuna Liberal,Conta de luz de clientes da CPFL sobe e deve impactar custo de vida na regiao,5,Regional,Regional,PRESSAO_SOCIAL,infraestrutura_urbana,direta,SMIDS_EXT,media,dado_auditavel,,"""Aneel aprovou reajuste em 22/04. Residencias/baixa tensao: +9,25%. Grandes consumidores/alta tensao: +18,75%. Impacto medio geral: 12,13%. Hortolandia e atendida pela CPFL Paulista. Reajuste incide diretamente sobre familias CadUnico (Tarifa Social de Energia pode atenuar parcialmente). Encarecimento da energia pressiona precos de produtos e servicos na regiao de Campinas. Fenomeno coletivo, recorrente (anual), mensuravel: serie historica de reajustes tarifarios CPFL estruturavel. Candidato forte a proxy de custo de vida e pressao sobre renda disponivel das familias vulneraveis. Charge do 25/04 (conta de luz sobe, bolsos descem) confirma percepcao popular do impacto.""",,,emergencia,IU_ENERGIA_CPFL_2026,sim - Condicao B
E3,2026-04-23,Tribuna Liberal,Hortolandia espera atender 360 pets durante mutirao de castracao animal,7,Hortolândia,nao_identificado,GOVERNANCA,capital_humano,indireta,GOV_MUNICIPAL,baixa,dado_auditavel,,"""Programa Castra Mais SP (Gov. Estado) + Prefeitura. 360 castracoes em 2 dias (23-24/04), 180/dia. Unidade movel no Dep. de Bem-Estar Animal. Proxima rodada: +400 castracoes anunciadas. Articulacao do deputado federal Delegado Bruno Lima. Relevancia para o Atlas: controle de zoonoses e bem-estar animal tem interface com saude publica (dengue, leishmaniose) e com perfil socioeconomico de bairros que nao castram por custo. R24: evento periodico, nao agrega serie de pressao.""",,,nao_aplicavel,,nao - R24
E4,2026-04-23,Tribuna Liberal,Mercado Livre abre 200 vagas de emprego em Hortolandia,7,Hortolândia,Jardim Sumarezinho,GOVERNANCA,renda_trabalho,indireta,GOV_MUNICIPAL,baixa,dado_auditavel,,"""Resultado do Feirae de Empregos municipal. Cargo: auxiliar logistico. Salario: R$2.025 + bonus + beneficios. Inscricoes ate 27/04, entrevistas 28/04 no Jd. Sumarezinho. Atuacao nos CDs de Sumare e Campinas. Interface com RT: vagas formais para moradores de Hortolandia com perfil CadUnico (Jd. Sumarezinho tem concentracao de familias registradas). Potencial proxy de geracao de emprego formal para publico vulneravel. R24: evento pontual de oferta de emprego, nao agrega serie de pressao social.""",,,nao_aplicavel,,nao - R24
E5,2026-04-23,Tribuna Liberal,Dia da Criatividade reune mais de 300 alunos em Hortolandia,7,Hortolândia,Jardim Rosolem,GOVERNANCA,capital_humano,indireta,GOV_ESTADUAL,baixa,fora_escopo_smids,,"""Escola Estadual Guido Rosolen, Jd. Rosolem. 300+ alunos. Evento com presenca do prefeito Zeze Gomes e primeira-dama. Classificado como GOV_ESTADUAL pois a unidade escolar e da rede estadual, nao municipal. Sem indicador IVS direto. Dado territorial: Jardim Rosolem identificado. Evento de integracao escola-comunidade com participacao do executivo municipal.""",,,nao_aplicavel,,nao - R24
