id_evento,data_publicacao,fonte,titulo,pagina,municipio,localidade,tipo_camada,dimensao_analitica,tipo_relacao_variavel,codigo_variavel,polaridade_evento,tipo_origem_evento,observacao,nota_analista,papel_no_ciclo,id_caso_pressao,entra_ipst,cod_loteamento,nivel_confianca_loteamento,data_classificacao
2026_05_15_01,2026-05-15,Tribuna Liberal,Nova etapa do Parque do Jd. Amanda sera entregue nas proximas semanas,7,Hortolandia,Jardim Amanda,GOVERNANCA,infraestrutura_urbana,indireta,SMIDS_EXT,positivo,infraestrutura,obra_publica_espaco_lazer | nova etapa inclui quadra poliesportiva pista caminhada academia ciclovia | recursos Fonplata,territorio recorrente no corpus de vulnerabilidade — Jardim Amanda e loteamento no 1 do PVSE-01; densidade longitudinal crescente no corpus,resposta,,nao,nao_identificado,alto,2026-05-15
2026_05_15_02,2026-05-15,Tribuna Liberal,Praca do Pastel recebe mutirao de limpeza e zeladoria geral,7,Hortolandia,Jardim Nossa Senhora de Fatima,GOVERNANCA,infraestrutura_urbana,indireta,SMIDS_EXT,positivo,infraestrutura,microgestao_urbana_cotidiana | zeladoria de pracas e canteiros em 9 areas da cidade | criticidade analitica baixa,evento de baixa criticidade incluido para registro de frequencia de atuacao territorial; nao alimenta indicadores; nao confundir com politica estruturante,standalone,,nao,nao_identificado,baixo,2026-05-15
2026_05_15_03,2026-05-15,Tribuna Liberal,Casal e preso por trafico durante patrulha no Jardim Nova Europa,7,Hortolandia,Jardim Nova Europa,PRESSAO_SOCIAL,capital_humano,indireta,CH_08,negativo,seguranca,trafico_drogas_jovens | mulher 25a buscou drogas no Jardim Amanda para entregar ao homem 45a | conexao territorial interbairro Amanda-Nova Europa | R21 nao aplicavel sem vitima letal,topologia social do risco — fluxo territorial do problema entre loteamentos; ocorrencia isolada sem serie confirmada; entra_ipst=nao por ausencia de persistencia,emergencia,,nao,nao_identificado,medio,2026-05-15
2026_05_15_04,2026-05-15,Tribuna Liberal,Pedestre morre atropelado na Rodovia Bandeirantes,7,Hortolandia,Rodovia Bandeirantes km 108,PRESSAO_SOCIAL,infraestrutura_urbana,direta,SMIDS_EXT,negativo,infraestrutura,vitima_letal | R21 ativo — violencia letal nunca contextual | trecho sem iluminacao — mobilidade insegura como producao de vulnerabilidade urbana | vitima nao identificada possivelmente populacao vulneravel,mortalidade viaria em trecho sem iluminacao revela interface exclusao urbana e risco de morte; rodovia cortando tecido urbano como vetor de vulnerabilidade territorial,emergencia,,sim,nao_identificado,baixo,2026-05-15
2026_05_15_05,2026-05-15,Tribuna Liberal,Comites PCJ e Ares-PCJ vao debater enfrentamento da epoca de estiagem,9,Regional,Regional,GOVERNANCA,infraestrutura_urbana,indireta,IU_01,positivo,infraestrutura,R27_CASO2 | Hortolandia depende diretamente do sistema Sabesp/PCJ | evento de planejamento de contingencia hidrica regional | interface com ciclo ativo IU_AGUA_SABESP_2026,incluido por R27 CASO 2 — causalidade plausivel e conexao institucional demonstravel; Sabesp/PCJ e o sistema de abastecimento de Hortolandia,resposta,IU_AGUA_SABESP_2026,nao,nao_identificado,nao_aplicavel,2026-05-15
